{"artifact_type":"artifact_inventory","artifacts":[{"byte_size":80,"file_type":"regular","kind":"markdown","path":"questions/q001-throughput/experiments/exp001-completed/README.md","sha256":"sha256:bd8b54158667cfd139740a854a3f3e3f19b642ebb19fd77e7dee0e1c7e6f96cc","support_status":"supported","symlink_target":null},{"byte_size":389,"file_type":"regular","kind":"json","path":"questions/q001-throughput/experiments/exp001-completed/outputs/experiment_report.json","sha256":"sha256:4bf7977e2379089b948891299acad85afb21056d02280f360549b1b4b7d86fdb","support_status":"supported","symlink_target":null}],"experiment_path":"questions/q001-throughput/experiments/exp001-completed","fingerprint":{"config_sha256":"sha256:897f2a3b2780a4106cb01259bf6925745b4d62624ea521f524239fecbe959e02","extra_inputs":{"artifact_count":2,"artifact_listing":[{"byte_size":80,"file_type":"regular","kind":"markdown","path":"questions/q001-throughput/experiments/exp001-completed/README.md","sha256":"sha256:bd8b54158667cfd139740a854a3f3e3f19b642ebb19fd77e7dee0e1c7e6f96cc","support_status":"supported","symlink_target":null},{"byte_size":389,"file_type":"regular","kind":"json","path":"questions/q001-throughput/experiments/exp001-completed/outputs/experiment_report.json","sha256":"sha256:4bf7977e2379089b948891299acad85afb21056d02280f360549b1b4b7d86fdb","support_status":"supported","symlink_target":null}]},"extra_inputs_sha256":"sha256:045a088a1354ba16c9320b5acdc4787c2aaaa6466daa98a75a715e6c40e55188","fingerprint_sha256":"sha256:49904d816596012972f9a53417fa6104be15c19318eb35b75fd41b4a6d5154a0","prerequisite_artifacts":[{"path":"paper/work/manifest.json","schema_name":"manifest.schema.json","sha256":"sha256:9fb4784305726d9918677b3b4edd81dd237d0ae58c73e49681e1b5a755e0c44e"}],"prerequisite_artifacts_sha256":"sha256:1b5c6c886f54412cbbaeaa1714d729fd59e152fb573e84c60dff267cabd9c148","schema_version":1,"source_files":[{"path":"questions/q001-throughput/experiments/exp001-completed/README.md","sha256":"sha256:bd8b54158667cfd139740a854a3f3e3f19b642ebb19fd77e7dee0e1c7e6f96cc"},{"path":"questions/q001-throughput/experiments/exp001-completed/outputs/experiment_report.json","sha256":"sha256:4bf7977e2379089b948891299acad85afb21056d02280f360549b1b4b7d86fdb"}],"source_files_sha256":"sha256:5ea99c1397a00d26b682eea6a758ecfd7d7808ab94bb752fb0c5ffc47c897716","stage":{"name":"inventory","version":1}},"question_path":"questions/q001-throughput","schema_version":1}
