{"artifact_type":"artifact_inventory","artifacts":[{"byte_size":76,"file_type":"regular","kind":"markdown","path":"questions/q001-throughput/experiments/legacy-baseline/README.md","sha256":"sha256:c7e6f2769b587ae3ae5ba9fe0e086c7a33853c68a1f621c6f320ac2c3fdf0d66","support_status":"supported","symlink_target":null},{"byte_size":78,"file_type":"regular","kind":"json","path":"questions/q001-throughput/experiments/legacy-baseline/outputs/summary.json","sha256":"sha256:358788722a13c5e7d124f147c9e40edbcc328781f858d02f3d7110d88ededa9f","support_status":"supported","symlink_target":null}],"experiment_path":"questions/q001-throughput/experiments/legacy-baseline","fingerprint":{"config_sha256":"sha256:897f2a3b2780a4106cb01259bf6925745b4d62624ea521f524239fecbe959e02","extra_inputs":{"artifact_count":2,"artifact_listing":[{"byte_size":76,"file_type":"regular","kind":"markdown","path":"questions/q001-throughput/experiments/legacy-baseline/README.md","sha256":"sha256:c7e6f2769b587ae3ae5ba9fe0e086c7a33853c68a1f621c6f320ac2c3fdf0d66","support_status":"supported","symlink_target":null},{"byte_size":78,"file_type":"regular","kind":"json","path":"questions/q001-throughput/experiments/legacy-baseline/outputs/summary.json","sha256":"sha256:358788722a13c5e7d124f147c9e40edbcc328781f858d02f3d7110d88ededa9f","support_status":"supported","symlink_target":null}]},"extra_inputs_sha256":"sha256:48684d5395ab76d9b0b9552b61526a761502c5c419595dfc04674e66abdeeec6","fingerprint_sha256":"sha256:9648dad3c8596b6f60fe8791615e2008ce0a7f6ea82d391aa1d707acf91d7a49","prerequisite_artifacts":[{"path":"paper/work/manifest.json","schema_name":"manifest.schema.json","sha256":"sha256:9fb4784305726d9918677b3b4edd81dd237d0ae58c73e49681e1b5a755e0c44e"}],"prerequisite_artifacts_sha256":"sha256:1b5c6c886f54412cbbaeaa1714d729fd59e152fb573e84c60dff267cabd9c148","schema_version":1,"source_files":[{"path":"questions/q001-throughput/experiments/legacy-baseline/README.md","sha256":"sha256:c7e6f2769b587ae3ae5ba9fe0e086c7a33853c68a1f621c6f320ac2c3fdf0d66"},{"path":"questions/q001-throughput/experiments/legacy-baseline/outputs/summary.json","sha256":"sha256:358788722a13c5e7d124f147c9e40edbcc328781f858d02f3d7110d88ededa9f"}],"source_files_sha256":"sha256:a16209dc33125067a867f3570c58b927c466c781f87c17fd3e1d728b10b45b62","stage":{"name":"inventory","version":1}},"question_path":"questions/q001-throughput","schema_version":1}
