{"artifact_type":"artifact_inventory","artifacts":[{"byte_size":173,"file_type":"regular","kind":"markdown","path":"questions/q001-throughput/experiments/exp002-incomplete/README.md","sha256":"sha256:f76fd124c1e0b4b09241c24dd58a09b11b768cd542f27eacbf1aec97d3f0216f","support_status":"supported","symlink_target":null},{"byte_size":150,"file_type":"regular","kind":"json","path":"questions/q001-throughput/experiments/exp002-incomplete/outputs/status.json","sha256":"sha256:8a04bc39e6c3cc264c84b22b236939f86d8ba390310d628507ff8ed855d6016b","support_status":"supported","symlink_target":null}],"experiment_path":"questions/q001-throughput/experiments/exp002-incomplete","fingerprint":{"config_sha256":"sha256:897f2a3b2780a4106cb01259bf6925745b4d62624ea521f524239fecbe959e02","extra_inputs":{"artifact_count":2,"artifact_listing":[{"byte_size":173,"file_type":"regular","kind":"markdown","path":"questions/q001-throughput/experiments/exp002-incomplete/README.md","sha256":"sha256:f76fd124c1e0b4b09241c24dd58a09b11b768cd542f27eacbf1aec97d3f0216f","support_status":"supported","symlink_target":null},{"byte_size":150,"file_type":"regular","kind":"json","path":"questions/q001-throughput/experiments/exp002-incomplete/outputs/status.json","sha256":"sha256:8a04bc39e6c3cc264c84b22b236939f86d8ba390310d628507ff8ed855d6016b","support_status":"supported","symlink_target":null}]},"extra_inputs_sha256":"sha256:024ee0d94dfa4f9a404e1f9c4b6afe473d8a2c9b3d99103dfff8fc823f5173bd","fingerprint_sha256":"sha256:5b17e642022bab03256e44d475f103a8af49fcb218aca048292a1c76f3e05f4d","prerequisite_artifacts":[{"path":"paper/work/manifest.json","schema_name":"manifest.schema.json","sha256":"sha256:9fb4784305726d9918677b3b4edd81dd237d0ae58c73e49681e1b5a755e0c44e"}],"prerequisite_artifacts_sha256":"sha256:1b5c6c886f54412cbbaeaa1714d729fd59e152fb573e84c60dff267cabd9c148","schema_version":1,"source_files":[{"path":"questions/q001-throughput/experiments/exp002-incomplete/README.md","sha256":"sha256:f76fd124c1e0b4b09241c24dd58a09b11b768cd542f27eacbf1aec97d3f0216f"},{"path":"questions/q001-throughput/experiments/exp002-incomplete/outputs/status.json","sha256":"sha256:8a04bc39e6c3cc264c84b22b236939f86d8ba390310d628507ff8ed855d6016b"}],"source_files_sha256":"sha256:b26fbe4631938c54344d0427673ac5b73caf3dad51f1fd8f73e2777744fe2b1e","stage":{"name":"inventory","version":1}},"question_path":"questions/q001-throughput","schema_version":1}
